{
  "critic_id": "ruskin",
  "theorist": "John Ruskin",
  "book": "The Elements of Drawing",
  "thesis": "The whole technical power of painting depends on the recovery of the innocence of the eye — a sort of childish perception of flat stains of colour, merely as such, without consciousness of what they signify. All great art is delicate: this is the only rule without exception respecting art. The excellence of an artist depends wholly on refinement of perception. Nature teaches obedience, not mastery. Colour is wholly relative — every hue is altered by every touch added elsewhere — while form is absolute. Composition cannot be taught by rule, but one can learn to recognize it. Nothing is ever seen perfectly, but only by fragments and under conditions of obscurity: mystery is a law of nature, not a defect of vision.",
  "core_concepts": [
    {
      "concept_id": "innocence_of_the_eye",
      "label": "Innocence of the Eye",
      "definition": "The whole technical power of painting depends on the recovery of a sort of childish perception of flat stains of colour, merely as such, without consciousness of what they signify — as a blind man would see them if suddenly gifted with sight. The trained artist has reduced himself as nearly as possible to this condition of infantine sight. Perception must precede execution: the primary question is not how the artist handles the brush but what the artist actually sees.",
      "key_concepts": [
        "Infantine sight: seeing flat patches of colour without interpreting them as objects — pre-conceptual perception",
        "The blind man analogy: seeing as if gifted with sight for the first time, unburdened by knowledge of what things are",
        "Perception before execution: the whole art of painting consists in perceiving the shape and depth of colour patches and reproducing them",
        "Conceptual knowledge as enemy: knowing a wall is flat or a tree is green prevents seeing the actual colour and gradation present",
        "Seeing truly is the chief aim — drawing follows naturally from accurate sight"
      ],
      "diagnostic_questions": [
        "Does the work show evidence of seeing what is actually there — colour patches, gradations, relative values — rather than what the artist knows to be there?",
        "Has conceptual knowledge been set aside? Are shadows rendered as they appear (coloured, gradated), not as convention dictates (grey, uniform)?",
        "Is local colour observed as inseparable from light — or has the artist drawn the object first and coloured it second?",
        "Does the rendering of surfaces suggest direct observation or formulaic execution from habit?"
      ],
      "indicators": {
        "strong_innocence": [
          "Surfaces show observed colour, not conventional colour — shadows carry hue, highlights are not simply white",
          "Local colour is inseparable from light: the colour of a thing and the light upon it are rendered as one perception",
          "Forms emerge from patches of colour and value rather than from drawn outlines filled in afterward",
          "The work shows surprise — unexpected colours, values, or relationships that come from looking rather than knowing"
        ],
        "weak_innocence": [
          "Surfaces are coloured by convention: grass is green, sky is blue, shadows are grey — no observed variation",
          "Objects are outlined first and then filled with local colour, separating line from colour observation",
          "Light and shade are treated as a separate layer applied on top of local colour",
          "The rendering is formulaic — habitual rather than observed, showing what the artist knows rather than what the artist sees"
        ]
      },
      "feedback_directions": {
        "strengthen": [
          "Set aside knowledge of what things are — look at the subject as a flat mosaic of coloured patches",
          "Observe the actual colour of shadows: they are never just darker versions of the local colour but carry their own hue",
          "Let forms emerge from value relationships rather than from outlines — Nature outlines none",
          "Test your seeing: compare what you have drawn to what is actually before you, not to what you know should be there"
        ],
        "refine": [
          "Check whether conceptual knowledge has crept back in — are any surfaces rendered from habit rather than observation?",
          "Ensure light and local colour remain fused throughout, not separated into distinct passes",
          "Look for unexpected colour relationships you may have overlooked — the more surprising, the more likely they are true"
        ]
      },
      "common_misreadings": [
        "Treating innocence of the eye as naivety or primitivism — Ruskin means disciplined pre-conceptual perception, not untrained simplicity",
        "Separating the observation of light/shade from local colour — Ruskin identifies this separation as destructive of accurate sight"
      ]
    },
    {
      "concept_id": "gradation",
      "label": "Gradation and Roundness",
      "definition": "All drawing depends primarily on the power of representing roundness. Nature is all made up of roundnesses — not the roundness of perfect globes, but of variously curved surfaces. Boughs are rounded, leaves are rounded, stones are rounded, clouds are rounded. Gradation — the continuous, subtle transition from one tone or colour to another — is visible on everything in Nature and is the supreme technical value. The real difficulties are to get the refinement of the forms and the evenness of the gradations.",
      "key_concepts": [
        "Roundness: the fundamental visual problem — all natural forms present variously curved surfaces to the eye",
        "Gradation: continuous tonal and chromatic transition — never abrupt, always subtle",
        "Local colour inseparable from light: the colour of a surface and its illumination are one observation, not two",
        "Colour is wholly relative: every hue is altered by every touch added in other places — while form is absolute",
        "Evenness: gradation must be smooth and controlled — the mark of patient, refined seeing"
      ],
      "diagnostic_questions": [
        "Is roundness convincingly rendered — do forms turn through continuous gradation rather than through abrupt value steps?",
        "Is gradation visible throughout — are transitions between tones and colours subtle and continuous?",
        "Are curved surfaces treated as variously curved (observed) or as schematic spheres/cylinders (formulaic)?",
        "Is the colour of each surface fused with its illumination, or have light and local colour been separated?"
      ],
      "indicators": {
        "strong_gradation": [
          "Forms turn convincingly: gradation is continuous across surfaces, conveying roundness without schematic shading",
          "Tonal transitions are subtle and even — no abrupt jumps where nature would present smooth change",
          "Colour gradation accompanies tonal gradation: hue shifts as value shifts, observed as one phenomenon",
          "The artist renders variously curved surfaces, not geometric approximations"
        ],
        "weak_gradation": [
          "Forms are flat or schematically shaded: value applied in bands rather than continuous gradation",
          "Abrupt tonal jumps where nature presents smooth transition — the rendering is stepped, not gradated",
          "Colour and value are treated separately: local colour applied first, shading overlaid second",
          "Surfaces read as geometric primitives (spheres, cylinders) rather than as observed curved forms"
        ]
      },
      "feedback_directions": {
        "strengthen": [
          "Study the gradation on a single curved surface — an egg, a stone, a leaf — and observe how tone changes continuously, never in steps",
          "Fuse colour observation with value observation: the shadow side of a warm object is not just darker but different in hue",
          "Slow down: evenness of gradation requires patience and delicacy of touch",
          "Look for gradation everywhere — even in apparently flat areas, nature presents subtle variation"
        ],
        "refine": [
          "Check transitions between major value areas: are they as smooth as what you observe in nature?",
          "Ensure roundness reads as variously curved, not as schematic — each surface has its own curvature",
          "Test relative colour: does each area still read correctly in relation to its neighbors, or has an added touch thrown the whole into disharmony?"
        ]
      },
      "common_misreadings": [
        "Treating gradation as blending or sfumato technique — Ruskin means the observed phenomenon of continuous tonal change on curved surfaces, not a rendering trick",
        "Ignoring that colour is wholly relative — adjusting one area without accounting for its effect on all neighboring areas"
      ]
    },
    {
      "concept_id": "laws_of_composition",
      "label": "The Nine Laws of Composition",